priority,title,keyword,slug,category,search_volume,difficulty,intent,notes
1,Associate Dentist Tax Deductions 2026: Complete Guide,associate dentist tax deductions 2026,associate-dentist-tax-deductions-2026,Associate tax,540,34,informational,Tax year specific
2,Associate Dentist Tax Calculator: Specialist Services,associate dentist tax calculator,associate-dentist-tax-calculator,Associate tax,620,36,transactional,Calculator intent
2,Associate Dentist Tax Return Guide,associate dentist tax return guide,associate-dentist-tax-return-guide,Associate tax,580,36,informational,Process guide
2,Dental Associate vs Self Employed: Complete Guide,dental associate vs self employed,dental-associate-vs-self-employed,Associate tax,490,35,informational,Employment status
2,Capital Allowances Dental Equipment: Complete Guide,capital allowances dental equipment,capital-allowances-dental-equipment,Practice accounting,440,38,informational,Equipment tax relief
2,Dental Practice Accountant Manchester: Specialist Services,dental practice accountant manchester,dental-practice-accountant-manchester,Practice accounting,420,39,transactional,Location-specific service
3,Dental Practice Accountant: Specialist Services,dental practice accountant,dental-practice-accountant,Practice accounting,1400,44,transactional,Service-seeking high intent
3,Dental Practice Accountant London: Specialist Services,dental practice accountant london,dental-practice-accountant-london,Practice accounting,640,42,transactional,Location-specific service
3,Private Dental Practice Tax: Complete Guide,private dental practice tax,private-dental-practice-tax,Practice finance,450,40,informational,Private vs NHS
