Keyword,Difficulty,"Search vol.","Search intent","SERP features",CPC,Competition
"digital agency accountants",12,10,"L, C","Local pack, Reviews, Video",0,0
"account manager digital agency job description",0,10,,,0,0
"digital marketing agency for accountants",0,10,,,0,0.08
"accounting for digital marketing agency",0,10,,,0,0.14
"senior account manager digital agency",0,10,,,0,0
"digital agency account manager",0,10,,,2.37,0
"account director digital agency",0,10,,,0,0
"digital agency account manager job description",0,10,,,0,0
"accountant digital marketing agency",16,10,I,"Related searches",0,0
"account executive digital agency",0,10,,,0,0
"accountants for digital agencies",2,10,"L, C","Local pack, Reviews, People also ask, Related searches",0,0
"account manager digital agency",0,10,,,2.37,0
"digital agency account executive job description",0,0,,,0,0
"digital agency account manager salary",0,0,,,0,0
"accountant for digital agencies",3,0,I,"Reviews, People also ask",0,0
"accounting for digital marketing agencies",1,0,I,"People also ask",0,0
"job desk account executive di dunia digital agency",0,0,,,0,0
"account director digital agency job description",0,0,,,0,0
"digital marketing agency account executive",0,0,,,0,0
"account manager in digital agency",0,0,,,0,0
"duties of an account manager digital agency",0,0,,,0,0
"accountancy digital marketing agency",16,0,I,"Reviews, People also ask, Related searches",0,0
"job description account manager digital agency",0,0,,,0,0
"account manager job description digital agency",0,0,,,0,0
"account manager jobs digital agency",0,0,,,0,0
"digital agency accountant",0,0,,,0,0
"account manager digital agency london",0,0,,,0,0
